{
  "format": "lunarsim-catalog",
  "version": 1,
  "description": "LunarHaul vehicle and site catalogue: the single source of every vehicle number on screen and of the real dimensions the 3D models are built from. Every number is a quantity {value, unit, flag, source}. The engine's own constants (rover capacity, speed and night operation; lander payloads and descent constants) are mirrored here and checked equal by tests/test_catalog.py; the engine does not read this file. Loader: lunarsim/catalog.py. Schema: lunarsim/schemas/catalog-v1.schema.json. Written 22 Oct 2026.",
  "flags": {
    "Spec": "a published specification or design value (URL in source)",
    "Measured": "measured in flight or test (URL in source)",
    "Modelled": "derived by our model or a stated calculation from sourced values",
    "Assumed": "our assumption where nothing is published; the reasoning is in source"
  },
  "materials": {
    "mli_gold": {
      "description": "Gold multi-layer insulation: aluminised polyimide, the gold colour is the polyimide on the outside; crinkle normal map",
      "base_color_linear": {"value": [0.8, 0.52, 0.16], "unit": "linear RGB", "flag": "Assumed", "source": "material rendering parameters are a modelling choice (design_research.md §2.2); appearance per NOAA NESDIS 'As Good As Gold': https://www.nesdis.noaa.gov/node/87"},
      "metalness": {"value": 1.0, "unit": "", "flag": "Assumed", "source": "material rendering parameters are a modelling choice (design_research.md §2.2); https://www.nesdis.noaa.gov/node/87"},
      "roughness": {"value": 0.4, "unit": "", "flag": "Assumed", "source": "material rendering parameters are a modelling choice (design_research.md §2.2); 0.3-0.5 with crinkle normals"}
    },
    "mli_silver": {
      "description": "Silver (aluminium-side-out) multi-layer insulation; crinkle normal map",
      "base_color_linear": {"value": [0.85, 0.85, 0.86], "unit": "linear RGB", "flag": "Assumed", "source": "material rendering parameters are a modelling choice (design_research.md §2.2); aluminised film per NOAA NESDIS: https://www.nesdis.noaa.gov/node/87"},
      "metalness": {"value": 1.0, "unit": "", "flag": "Assumed", "source": "material rendering parameters are a modelling choice (design_research.md §2.2); https://www.nesdis.noaa.gov/node/87"},
      "roughness": {"value": 0.35, "unit": "", "flag": "Assumed", "source": "material rendering parameters are a modelling choice (design_research.md §2.2); crinkled foil"}
    },
    "white_paint": {
      "description": "White thermal-control paint (dielectric)",
      "base_color_linear": {"value": [0.8, 0.8, 0.78], "unit": "linear RGB", "flag": "Assumed", "source": "material rendering parameters are a modelling choice (design_research.md §2.2); white dielectric"},
      "metalness": {"value": 0.0, "unit": "", "flag": "Assumed", "source": "material rendering parameters are a modelling choice (design_research.md §2.2); dielectric"},
      "roughness": {"value": 0.6, "unit": "", "flag": "Assumed", "source": "material rendering parameters are a modelling choice (design_research.md §2.2); roughness ~0.6"}
    },
    "aluminium": {
      "description": "Bare or lightly anodised aluminium structure",
      "base_color_linear": {"value": [0.91, 0.92, 0.92], "unit": "linear RGB", "flag": "Assumed", "source": "material rendering parameters are a modelling choice (design_research.md §2.2); near the reflectance of aluminium"},
      "metalness": {"value": 1.0, "unit": "", "flag": "Assumed", "source": "material rendering parameters are a modelling choice (design_research.md §2.2); metal"},
      "roughness": {"value": 0.45, "unit": "", "flag": "Assumed", "source": "material rendering parameters are a modelling choice (design_research.md §2.2); brushed"}
    },
    "stainless_steel": {
      "description": "Stainless-steel hull (Starship-class)",
      "base_color_linear": {"value": [0.65, 0.64, 0.62], "unit": "linear RGB", "flag": "Assumed", "source": "material rendering parameters are a modelling choice (design_research.md §2.2); Starship's stainless-steel structure: https://en.wikipedia.org/wiki/Starship_HLS"},
      "metalness": {"value": 1.0, "unit": "", "flag": "Assumed", "source": "material rendering parameters are a modelling choice (design_research.md §2.2); metal"},
      "roughness": {"value": 0.3, "unit": "", "flag": "Assumed", "source": "material rendering parameters are a modelling choice (design_research.md §2.2); rolled sheet"}
    },
    "solar_cell": {
      "description": "Solar array face: very dark blue cells, low roughness",
      "base_color_linear": {"value": [0.02, 0.03, 0.08], "unit": "linear RGB", "flag": "Assumed", "source": "material rendering parameters are a modelling choice (design_research.md §2.2); very dark blue, low roughness"},
      "metalness": {"value": 0.2, "unit": "", "flag": "Assumed", "source": "material rendering parameters are a modelling choice (design_research.md §2.2); cover glass over cells"},
      "roughness": {"value": 0.15, "unit": "", "flag": "Assumed", "source": "material rendering parameters are a modelling choice (design_research.md §2.2); low roughness"}
    },
    "radiator": {
      "description": "Thermal radiator panel (white, high emissivity)",
      "base_color_linear": {"value": [0.86, 0.86, 0.86], "unit": "linear RGB", "flag": "Assumed", "source": "material rendering parameters are a modelling choice (design_research.md §2.2); white high-emissivity coating"},
      "metalness": {"value": 0.0, "unit": "", "flag": "Assumed", "source": "material rendering parameters are a modelling choice (design_research.md §2.2); dielectric"},
      "roughness": {"value": 0.3, "unit": "", "flag": "Assumed", "source": "material rendering parameters are a modelling choice (design_research.md §2.2); smooth coating"}
    },
    "regolith_dust": {
      "description": "South-pole highland regolith and the dust on the lower parts of vehicles",
      "base_color_linear": {"value": [0.12, 0.115, 0.105], "unit": "linear RGB", "flag": "Modelled", "source": "Moon geometric albedo 0.12, Bond 0.11 (NSSDC: https://nssdc.gsfc.nasa.gov/planetary/factsheet/moonfact.html); highlands 9-12 %; very slight warm tint (design_research.md §2.2)"},
      "metalness": {"value": 0.0, "unit": "", "flag": "Assumed", "source": "material rendering parameters are a modelling choice (design_research.md §2.2); dielectric"},
      "roughness": {"value": 0.95, "unit": "", "flag": "Assumed", "source": "material rendering parameters are a modelling choice (design_research.md §2.2); loose fine powder"}
    },
    "sintered_regolith": {
      "description": "Prepared pad surface (sintered or polymer-bound regolith), slightly darker than loose regolith",
      "base_color_linear": {"value": [0.09, 0.087, 0.08], "unit": "linear RGB", "flag": "Assumed", "source": "material rendering parameters are a modelling choice (design_research.md §2.2); darker than loose regolith (compacted, glassy)"},
      "metalness": {"value": 0.0, "unit": "", "flag": "Assumed", "source": "material rendering parameters are a modelling choice (design_research.md §2.2); dielectric"},
      "roughness": {"value": 0.8, "unit": "", "flag": "Assumed", "source": "material rendering parameters are a modelling choice (design_research.md §2.2); paved surface"}
    }
  },
  "entries": [
    {
      "id": "CLPS",
      "kind": "lander",
      "name": "CLPS-class lander (2 t at the gate)",
      "engine_class": "CLPS",
      "reference_vehicle": {
        "name": "Intuitive Machines Nova-C",
        "url": "https://en.wikipedia.org/wiki/Intuitive_Machines_Nova-C",
        "status": "flown"
      },
      "representative": false,
      "representative_note": "Nova-C's published shape and size. The descent constants are the engine's SPLICE 2 t reference lander, not Nova-C's own (Nova-C is lighter). Alternative look: griffin. The leg span is not published (Assumed).",
      "dims": {
        "height_m": {"value": 3.938, "unit": "m", "flag": "Spec", "source": "Nova-C height 3.938 m (the infobox says 3 m): https://en.wikipedia.org/wiki/Intuitive_Machines_Nova-C"},
        "diameter_m": {"value": 1.6, "unit": "m", "flag": "Spec", "source": "Nova-C body 1.6 m (NASA NDL paper; Wikipedia gives 2 m): https://ntrs.nasa.gov/api/citations/20250007036/downloads/aasimndl.pdf"},
        "leg_count": {"value": 6, "unit": "", "flag": "Spec", "source": "six landing legs: https://en.wikipedia.org/wiki/Intuitive_Machines_Nova-C"},
        "leg_span_m": {"value": 3.6, "unit": "m", "flag": "Assumed", "source": "Nova-C's leg span is not published; drawn at the Apollo LM's ratio of footprint to body width, 9.4 m with landing gear extended / 4.22 m without = 2.23 (https://en.wikipedia.org/wiki/Apollo_Lunar_Module), x 1.6 m body"}
      },
      "capacity_kg": {"value": 500, "unit": "kg", "flag": "Modelled", "source": "upper bound of the engine's 100-500 kg payload per CLPS landing (lunarsim/scenario.py LANDER_TYPES); CLPS task orders deliver 0.07-0.475 t: https://www.nasa.gov/wp-content/uploads/2025/02/iparch10-wp-logistics-mobility-cargo.pdf"},
      "max_item_kg": {"value": 500, "unit": "kg", "flag": "Modelled", "source": "largest single item on a CLPS landing (lunarsim/scenario.py LANDER_TYPES)"},
      "gate": {
        "m_gate_kg": {"value": 2000.0, "unit": "kg", "flag": "Spec", "source": "SPLICE robotic reference lander, 2,000 kg with a 5,000 N motor: https://ntrs.nasa.gov/api/citations/20200002415/downloads/20200002415.pdf [mirrors lunarsim/lander/classes.py]"},
        "prop_gate_kg": {"value": 300.0, "unit": "kg", "flag": "Assumed", "source": "15 % of gate mass; Assumed (terminal descent from the gate needs ~100 kg at Isp 311) [mirrors lunarsim/lander/classes.py]"},
        "t_max_n": {"value": 5000.0, "unit": "N", "flag": "Spec", "source": "https://ntrs.nasa.gov/api/citations/20200002415/downloads/20200002415.pdf [mirrors lunarsim/lander/classes.py]"},